
<!ENTITY  nbsp         "&#xA0;" >
<!ENTITY  mdash        "&#xA0;- " >


<!ELEMENT change_log   (section)* >

<!ELEMENT section      (changes)* >
<!ATTLIST section      title  CDATA #REQUIRED >

<!ELEMENT changes      (change)* >
<!ATTLIST changes      ver    CDATA #REQUIRED
                       date   CDATA #REQUIRED
>

<!ELEMENT change       (para)* >
<!ATTLIST change       type (bugfix | feature | change | security | workaround) #IMPLIED >

<!ELEMENT para         (#PCDATA | at | br | nobr)* >
<!ATTLIST para         lang (ru | en) #REQUIRED >

<!ELEMENT at           EMPTY >
<!ELEMENT br           EMPTY >
<!ELEMENT nobr         (#PCDATA) >
